index,url,job_title,company,location,remote_option,salary,type,description
17,https://ca.indeed.com/pagead/clk?mo=r&ad=-6NYlbfkN0DzsFKzjYNAOE5qO8AUWMVFLRstdw0cwpr_Y3rRC8ynI7IriApyGytSOzgUGA5P7UqTiWa8BesKJV56Q6vNP3XSQ2ZAYW0bU4HzA6p0j8HB1OzmDbzORtUuJ07yUGuOMVx62apGBEOrAYIQFjRszzgWoGpXhkLV7l0O4Awcr7EprJRUujRgYtv_B7K9AMUCahPFKDboiCSrMMHwtYt0z3pGJ5_h2CuI2ca9C0FrdCnnoxTZhvjlP7aJbVyOJDJbpfVpUkcNOwOA36QsNvGOLmbt0MjRUpcbGQy_HvBF136YO_3ExdVF-lNUbHY133ZkKgUw9ZqXqZO4Nc-Mxawb2b6jV5YgzcWwWsErE8b1A-cIBTtlKYqiEdnovksICI_LsWc-yIv7t2EpW8qyZtIHsCrvUNA7YVvEdzLQiujC22KUfeB8MBfz61JrhbfXYIh6kYObCBHEPyalscaU_vLk0Ju0mvOAemTEuR0FuupEzWXqswXvQ-pcOfQdobtD_arVps7uAAhJ-Bi9y3u6Q_6pZb3swL5Jq8DM3SPS2J9LoRMPYywKBlzPzLy4TcpWi8SZFMmpoIVNERrx9PgDBfNQNJMiRxV6DYui5uNR2UiTHyIr8b-mAxYxIds_6EB4ZdDpmzpBsxS4pl1ry2aXIpBxSbpW6qq20SH1FC4=&p=2&fvj=1&vjs=3,GEC Educator,lululemon,Canada,Remote,$15 an hour,"Full-time, Part-time","""Who we  are    
lululemon is a yoga-inspired technical apparel company up to big things. The practice and philosophy of yoga informs our overall purpose to elevate the world through the power of practice. We are proud to be a growing global company with locations all around the world, from Vancouver to Shanghai, and places in between. We owe our success to our innovative product, our emphasis on our stores, our commitment to our people, and the incredible connections we get to make in every community we are in.  
About this team   
The Guest Education Centre (GEC) is the contact center for lululemon. With offices in Vancouver, BC and Mississauga, ON, and a growing Work from Home (WFH) program, we are  a vital frontline connection with our guests. Most people call them customers, but because we create an inviting environment, we call them guests.   
  
A day in the life   
We provide a great guest experience worldwide through a variety of channels including phone, email, live chat, and more. We answer questions and resolve guest concerns on just about everything under the lululemon sun. As a GEC Work from Home educator, you are empowered to be solution oriented, resourceful and offer resolutions that create a guest for life. This role is for you if you enjoy working independently while problem solving resolutions through authentic connection over phone, email, and chat. There is a lot of variety to keep you stimulated, but enough familiarity to become a master of Guest Experience.   
Key Responsibilities   
Deliver world-class guest experience through all GEC channels including phones, email, chat and any future channels. 
Resolves guest concerns and inquiries quickly and with a sense of urgency. 
Responsible for achieving personal quality and efficiency targets. 
Responsible for maintaining a high level of knowledge on lululemon policies, procedure, product education and guest experience mandates to support guest interactions. 
Support growing ecommerce business through placing orders, setting up returns, communicating programs and troubleshooting. 
Participates in ongoing development, career pathway and performance conversations to develop skills that support with job performance. 
Responsible for adhering to schedule, including scheduled channel, break times and communication catch up. 
Responsible for completing company and GEC-wide communications and trainings to stay up-to-date on organization, employee and guests updates. 
Ensures privacy practices are followed at all times to protect guest, personal and company information. 
Actively contributes to an inclusive work environment through our IDEA initiatives and priorities. 
Multi-tasks and efficiently navigates through several programs and applications to provide solutions and tracking of guest interactions. 
Qualifications   
Resourceful and solution-oriented with excellent problem-solving skills.  
Minimum 1 year of customer service experience required.  
You have exceptional customer service skills including excellent verbal and written communication.   
You have the ability to direct conversations and resolve guest inquiries over the phone.  
You can navigate multiple guest conversations at once over chat.  
Intermediate to advanced computer skills; this includes proficiency in Microsoft Office, an ability to type 50 wpm, and strong experience navigating the internet.   
Strong organizational, multitasking, and time management skills.   
Able to see trends through transferable knowledge and communicate them effectively.   
Responsible and dependable, you have a great work ethic and work well independently.  
High school diploma is required.   
Work from Home Requirements   
General requirements: 
A private, quiet, distraction-free, workspace with a door you can shut and work without interruption. 
Reside and work in a province/state where lululemon operates.   
Disciplined work ethic - a self-starter with the ability to work independently in a fast-paced environment.   
You will require your own hardware (desktop or laptop) for the training period of your employment. After your training is complete, we will provide you with a computer to do your work from home. 
Your computer must either run Windows 10 (not 10S), macOS Catalina (10.15), or macOS Big Sur (11) 
Your device must also have an available USB port to connect a headset, and anti-virus software that's updated and active. 
Chromebooks and iPads are not acceptable hardware devices. 
Network requirements:  
Internet Download Speed of 50 Mbps or greater 
Internet Upload Speed of 15 Mbps or greater 
Connection has less than 100ms of latency (ping) 
Hotspots, dial-up and wireless connectivity are not acceptable connections.    
Desk requirements:  
Desk space for 1 x 24” monitor, mouse, keyboard, and a mini desktop computer. 
minimum: 85cm (2.75') width and 75cm (2.5') depth desk size for 1 monitor setup. 
ideal: 120 cm (4') x 75cm (2.5') for 2 monitors 
Schedule   
Shift times range from 5am to 9pm PST on weekdays and 6am to 6pm PST on weekends, depending on your location. Our guests lead lives outside the standard 9-5 and we are right there with them, which means being available for them in the opening and closing hours. 
Convert times for HST, MST, CST, AST, EST 
Hours expectation for Canada:  
Full Time is 20-40 hours per week.  
Part Time is up to 19 hours per week. 
Hours expectation for United States:  
Full Time is 24-40 hours per week 
Part Time is up to 23 hours per week 
Must haves   
Acknowledges the presence of choice in every moment and takes personal responsibility for their life.  
Possesses an entrepreneurial spirit and continuously innovates to achieve great results.   
Communicates with honesty and kindness, and creates the space for others to do the same.   
Leads with courage, knowing the possibility of greatness is bigger than the fear of failure.   
Fosters connection by putting people first and building trusting relationships.   
Integrates fun and joy as a way of being and working, aka doesn’t take themselves too seriously.   
Reference ID: 10729 
Job Types: Full-time, Part-time 
Salary: From $15.00 per hour 
Additional pay: 
Bonus pay 
Benefits: 
Store discount 
Wellness program 
Work from home 
Work remotely: 
Yes"""
18,https://ca.indeed.com/rc/clk?jk=9a40f69f13770599&fccid=65a610215742c669&vjs=3,Call Centre Agent (Canada Virtual) (Flex),American Express Global Business Travel,Remote,Remote,N/A,N/A,"""American Express Global Business Travel (GBT)  
equips companies of all sizes with the insights, tools, services and expertise they need to keep their travelers informed, focused and productive while on the road. With approximately 18,000 employees and operations in nearly 140 countries worldwide, American Express GBT empowers customers to take control of their travel programs, optimizing the return on their travel and meetings investments, while, more importantly, providing extraordinary traveler care.
 
We’re moving faster than ever and introducing new products, services, and strategies that will revolutionize the travel industry and bring greater value to our business customers. Our clients’ success expands our success, so we put our heart and soul into helping our clients achieve results that exceed all expectations. As the world’s largest travel management company, we are continuing to build alliances with key travel leaders and suppliers throughout the world, strengthening our position as a quality provider to companies of all sizes.  
Get ready to make impressions that will last.
 
We are seeking motivated customer focused individuals interested in exploring an amazing career in travel...no travel experience or Travel Diploma necessary as WE WILL TRAIN YOU!
 
Key Responsibilities:
 
Handling inbound calls from customers to assist with booking their travel needs as well as support merchandise/gift card/rewards point redemption processes (everything from redeeming collected points for the latest tech toy to assisting a customer in lowering their mortgage bill or paying off their credit card with rewards)
 
Resolve customer inquiries at the first point of contact
 
Addressing and clearing out voicemail by returning calls
 
Voice, Email & Chat support
 
Ability to support multiple accounts, each with their own dedicated tools and technology
 
Usage of telephony system & soft phone application involving precise logging
 
Educate customers on products, programs, and services such as flights, hotels, gift cards and merchandise
 
Customer Service escalation handling and first call resolution.
 
Technical and online navigational support and trouble shooting
 
Utilize online and internal resources to ensure interactions are accurate and compliant with all business processes aligned with our loyalty program rules and regulations.
 
Use of multiple tools, booking and redemption platforms
 
Flight exchanges/refunds/schedule changes/involving manual calculations
 
Servicing clients across the globe with predominant focus on our clientele within North America
 
Email management
 
Remain current with industry advancements, Loyalty training and reference material.
 
Computer usage (Microsoft proficiency), and internet skills.
 
Scorecard metrics in place to adequately measure individual and team performance
 
Key Qualifications:
 
Typing proficiency: 45 WMP
 
Aptitude for and quickly adaptable to current technology and applications
 
Flexibility: Shift work in a virtual call center environment, open 7 days a week until midnight EST.
 
Weekly hours of work may fluctuate between 30 - 40 hours
 
High Level of Customer Service consisting of:
 
Empathy
 
Effective listening and attentiveness
 
Persuasive speaking skills
 
Adaptability
 
Taking responsibility in managing various situations
 
Patience
 
Responsive, critical thinking, solution oriented
 
Decision making skills
 
Collaborative, team oriented, respectful and professional with clients, colleagues and leadership
 
Proactive ability to identify problems (technical; account or client program specific issues), form solutions, and execute step-by-step troubleshooting procedures
 
High sense of urgency with the utmost level of respect and adherence to privacy and confidentiality protocols
 
Proficiency in spoken and written English
 
Additional language skills; French and or Spanish an asset.
 
High School Diploma or the GED Equivalent
 
Travel Diploma an asset
 
AmexGBT is committed to equal employment opportunity regardless of race, color, ancestry, religion, sex, national origin, sexual orientation, age, citizenship, marital status, family or parental status, gender identity. 

 
Location
 
Canada>Virtual Location 

 
It is our policy to provide equal employment opportunities to all individuals based on job-related qualifications and ability to perform a job, without regard to age, gender, gender identity, sexual orientation, race, color, religion, creed, national origin, disability, genetic information, veteran status, citizenship or marital status, and to maintain a non-discriminatory environment free from intimidation, harassment or bias based upon these grounds. 

 
GBT Recruitment Privacy Statement"""
19,https://ca.indeed.com/rc/clk?jk=cc01db8aadf1c19f&fccid=043ffd4709dd4cef&vjs=3,Customer Service Representative Work from Home Option,Optima Communications International Inc.,Remote,Remote,$15 an hour,N/A,"""Casual-professional, friendly and positive office environment, working with great people who thrive on teamwork and collaboration. We are each other’s backbone and the team is highly agile, adaptable and resilient in meeting corporate goals/objectives, whether it be through extra help, inspiration/motivation, mentorship, coaching for success or agreeing to shift trades, we are here to help and foster an inclusive working environment that encourages innovation, creativity and change.
 

***Work from Home Availability***
 

At present time all Optima Communications Intr. Inc. employees at all work site are asked to work remotely whenever and wherever possible. In consideration of necessary safety measures related to COVID 19, we are committed to identifying work approach that is flexible while ensuring continued critical operations and services .
 

 
We offer: 

Minimum of five (5) shifts per week (Monday through to Friday) scheduled between 8:00AM to 8:00PM, as business requires.
 
Occasional Saturday shifts as business requires
 
Willing to work Public Holidays as per the business needs
 
Offering guaranteed base of $15.00 per hour
 
$300 annual benefit health spending reimbursement plan for you and your family after 90 days of employment
 
Fully paid initial training
 
Access to Perkopolis, Canada's leading employee perk program (5-20% discounts across 450+companies)
 
Growth & development opportunities including, on-going Workshops, Certification, and Optima’s Specialist Training Program.
 

 
Qualifications: 

Minimum 3- 6 months customer service experience
 
High School Diploma
 
Strong communication skills, ability to multi-task at the same time
 
Genuine eagerness to help customers with care, professionalism and diplomacy
 
Exceptionally polite, friendly and courteous
 
Demonstrate good listening skills to help customers with their concerns while maintaining composure at all times
 
Strong work ethic and positive attitude with excellent interpersonal skills that allows others to work effectively and productively within a diverse environment
 
Ability to effectively communicate both verbally and typing with attention to detail
 
Someone that is technology savvy, this job is for you
 
Webchat, Email ,Social media and other online channels an asset but not required
 
Proven ability for data entry and typing skill with minimum 35 WPM
 

 
Location: 

In the heart of downtown Toronto, in a bright, beautiful professional building, brick walls and 13' ceilings - 2 minutes from Union Station subway station & Go Transit Hours of Operation:
 

Monday to Friday between 8 am – 8 pm
 

Occasional Saturday shifts and Public Holidays as business requires
 

 
Description: 

Can you offer superior customer service in a fast-paced work environment? You will be providing a wide range of inbound/outbound customer service. Key responsibilities including, account explanation,maintenance and payments.
 

If you are an energetic, self-motivated and a customer service oriented individual looking to learn and develop in a lasting career in customer service, we have immediate Full-Time opportunities.
 

The successful candidate will possess the unique combination of rapport-building, presentation skills and experience required to quickly gather data, identify specific needs of potential customers and inform them and/or perform the necessary steps to ensure good account standings.
 

 
About Us : 

Optima Communications International Inc. is a third party contact centre outsourcer providing solutions to major businesses since 1992. We pride ourselves on our people and the close working relationships we have with long standing clients, market leaders in Financial, Utilities and Business Services. We’ve established a sterling reputation in our industry as the call centre of choice by acting as a seamless extension of our clients and their business.
 

Complete our on line application, and If selected you will be contacted via phone by a member of our Recruitment Team.
 

Optima Communications International Inc. is committed to providing accommodations for people with disabilities. Accommodations will be provided in all parts of the hiring process as required under Optima Communications International Inc. Employment Accommodation policy. Applicants need to make their needs known in advance
 

Due to the volume of applications we receive; only those candidates selected for telephone interviews will be contacted.
 

Optima wishes you all the best in your employment search!"""
20,https://ca.indeed.com/rc/clk?jk=97840525a310907d&fccid=202ab84cde24fc35&vjs=3,Game Master,Wicked Interactive,Remote,Remote,N/A,N/A,"""Would you like to see a major MMO game before it's released? 

 

 Well how about getting an opportunity to potentially create a career out of gaming? 

 

 Wicked Interactive which publishes MMO games through subagames.com is looking to invite selected candidtates an
 opportunity to learn about the MMO game industry and behind the scenes of MMO operation. 

 

 If you'd like to contribute to this exiting industry and tihnk you've got what it takes, apply for the MMO
 Game Master role by submitting your resume and CV to: jobs@wickedinteractiveltd.com 

 

 This position remote while headquarters is located in Toronto. Successful candidates must be eligible to work and reside in Canada. 

 
Job Description 

 
Test MMO Games to evaluate whethere they are at the desired level of quality 

 
Report any problems found or suggestions in detail both in verbal and in written communiavtion to a supervisor 

 
Reproduce bugs on a consistent basis, while documenting all steps taken to cause it 

 
Give feedback on usability and ""Fun Factor"" 

 
Develop and execute test cases 

 
Job Requirements 

 
Avid MMO gamer with a passion for MMO games 

 
Superior attention to detail 

 
Excellent communication skills 

 
Analytical/Research Skills 

 
Ability to adapt and prioritize 

 
Must have customer service experience 

 
Good investigative skills"""
